{
  "generatedAt": "2026-08-05T23:24:59Z",
  "pointsOfInterest": [
    {
      "categoryIds": [],
      "geometry": {
        "bbox": {
          "height": 17.7839,
          "width": 13.0685,
          "x": 914.64,
          "y": 246.4463
        },
        "center": {
          "x": 921.1742,
          "y": 255.3382
        },
        "coordinates": [
          921.1742,
          255.3382
        ],
        "focusPoint": {
          "x": 921.1742,
          "y": 255.3382
        },
        "normalizedCenter": {
          "x": 0.38639858,
          "y": 0.15162601
        },
        "type": "Point",
        "validated": false
      },
      "id": "poi-gate-03",
      "name": "Portão 8",
      "normalizedName": "portao 8",
      "source": {
        "file": "BIL26-0526.pdf",
        "page": 1,
        "type": "pdf-map"
      },
      "standId": null,
      "streetId": null,
      "svgElementId": "poi-gate-03",
      "type": "gate",
      "validation": {
        "confidence": 0.78,
        "evidence": [
          "position-of-visible-text-label"
        ],
        "notes": [
          "Point is the center of the visible label; icon or doorway geometry was not substituted without evidence."
        ],
        "status": "needs-review"
      }
    },
    {
      "categoryIds": [],
      "geometry": {
        "bbox": {
          "height": 15.3958,
          "width": 13.0684,
          "x": 1140.84,
          "y": 256.4063
        },
        "center": {
          "x": 1147.3741,
          "y": 264.1042
        },
        "coordinates": [
          1147.3741,
          264.1042
        ],
        "focusPoint": {
          "x": 1147.3741,
          "y": 264.1042
        },
        "normalizedCenter": {
          "x": 0.4812811,
          "y": 0.15683149
        },
        "type": "Point",
        "validated": false
      },
      "id": "poi-gate-04",
      "name": "Portão 6",
      "normalizedName": "portao 6",
      "source": {
        "file": "BIL26-0526.pdf",
        "page": 1,
        "type": "pdf-map"
      },
      "standId": null,
      "streetId": null,
      "svgElementId": "poi-gate-04",
      "type": "gate",
      "validation": {
        "confidence": 0.78,
        "evidence": [
          "position-of-visible-text-label"
        ],
        "notes": [
          "Point is the center of the visible label; icon or doorway geometry was not substituted without evidence."
        ],
        "status": "needs-review"
      }
    },
    {
      "categoryIds": [],
      "geometry": {
        "bbox": {
          "height": 17.7839,
          "width": 13.0684,
          "x": 76.2,
          "y": 342.2063
        },
        "center": {
          "x": 82.7342,
          "y": 351.0982
        },
        "coordinates": [
          82.7342,
          351.0982
        ],
        "focusPoint": {
          "x": 82.7342,
          "y": 351.0982
        },
        "normalizedCenter": {
          "x": 0.03470395,
          "y": 0.20849062
        },
        "type": "Point",
        "validated": false
      },
      "id": "poi-gate-02",
      "name": "Portão 7",
      "normalizedName": "portao 7",
      "source": {
        "file": "BIL26-0526.pdf",
        "page": 1,
        "type": "pdf-map"
      },
      "standId": null,
      "streetId": null,
      "svgElementId": "poi-gate-02",
      "type": "gate",
      "validation": {
        "confidence": 0.78,
        "evidence": [
          "position-of-visible-text-label"
        ],
        "notes": [
          "Point is the center of the visible label; icon or doorway geometry was not substituted without evidence."
        ],
        "status": "needs-review"
      }
    },
    {
      "categoryIds": [],
      "geometry": {
        "bbox": {
          "height": 18.0237,
          "width": 13.0684,
          "x": 1360.6799,
          "y": 343.0464
        },
        "center": {
          "x": 1367.2141,
          "y": 352.0582
        },
        "coordinates": [
          1367.2141,
          352.0582
        ],
        "focusPoint": {
          "x": 1367.2141,
          "y": 352.0582
        },
        "normalizedCenter": {
          "x": 0.57349585,
          "y": 0.20906071
        },
        "type": "Point",
        "validated": false
      },
      "id": "poi-gate-05",
      "name": "Portão 10",
      "normalizedName": "portao 10",
      "source": {
        "file": "BIL26-0526.pdf",
        "page": 1,
        "type": "pdf-map"
      },
      "standId": null,
      "streetId": null,
      "svgElementId": "poi-gate-05",
      "type": "gate",
      "validation": {
        "confidence": 0.78,
        "evidence": [
          "position-of-visible-text-label"
        ],
        "notes": [
          "Point is the center of the visible label; icon or doorway geometry was not substituted without evidence."
        ],
        "status": "needs-review"
      }
    },
    {
      "categoryIds": [],
      "geometry": {
        "bbox": {
          "height": 3.8783,
          "width": 37.8639,
          "x": 1047.12,
          "y": 370.7725
        },
        "center": {
          "x": 1066.0519,
          "y": 372.7116
        },
        "coordinates": [
          1066.0519,
          372.7116
        ],
        "focusPoint": {
          "x": 1066.0519,
          "y": 372.7116
        },
        "normalizedCenter": {
          "x": 0.44716944,
          "y": 0.22132519
        },
        "type": "Point",
        "validated": false
      },
      "id": "poi-service-access-02",
      "name": "ACESSO SERVIÇO HALL 02",
      "normalizedName": "acesso servico hall 02",
      "source": {
        "file": "BIL26-0526.pdf",
        "page": 1,
        "type": "pdf-map"
      },
      "standId": null,
      "streetId": null,
      "svgElementId": "poi-service-access-02",
      "type": "service-access",
      "validation": {
        "confidence": 0.9,
        "evidence": [
          "position-of-visible-text-label"
        ],
        "notes": [
          "Point is the center of the visible label; icon or doorway geometry was not substituted without evidence."
        ],
        "status": "validated"
      }
    },
    {
      "categoryIds": [],
      "geometry": {
        "bbox": {
          "height": 3.8783,
          "width": 37.8638,
          "x": 1148.16,
          "y": 389.2526
        },
        "center": {
          "x": 1167.0919,
          "y": 391.1917
        },
        "coordinates": [
          1167.0919,
          391.1917
        ],
        "focusPoint": {
          "x": 1167.0919,
          "y": 391.1917
        },
        "normalizedCenter": {
          "x": 0.48955198,
          "y": 0.23229913
        },
        "type": "Point",
        "validated": false
      },
      "id": "poi-service-access-01",
      "name": "ACESSO SERVIÇO HALL 01",
      "normalizedName": "acesso servico hall 01",
      "source": {
        "file": "BIL26-0526.pdf",
        "page": 1,
        "type": "pdf-map"
      },
      "standId": null,
      "streetId": null,
      "svgElementId": "poi-service-access-01",
      "type": "service-access",
      "validation": {
        "confidence": 0.9,
        "evidence": [
          "position-of-visible-text-label"
        ],
        "notes": [
          "Point is the center of the visible label; icon or doorway geometry was not substituted without evidence."
        ],
        "status": "validated"
      }
    },
    {
      "categoryIds": [],
      "geometry": {
        "bbox": {
          "height": 3.8783,
          "width": 37.8638,
          "x": 323.16,
          "y": 390.9325
        },
        "center": {
          "x": 342.0919,
          "y": 392.8717
        },
        "coordinates": [
          342.0919,
          392.8717
        ],
        "focusPoint": {
          "x": 342.0919,
          "y": 392.8717
        },
        "normalizedCenter": {
          "x": 0.14349492,
          "y": 0.23329671
        },
        "type": "Point",
        "validated": false
      },
      "id": "poi-service-access-05",
      "name": "ACESSO SERVIÇO HALL 05",
      "normalizedName": "acesso servico hall 05",
      "source": {
        "file": "BIL26-0526.pdf",
        "page": 1,
        "type": "pdf-map"
      },
      "standId": null,
      "streetId": null,
      "svgElementId": "poi-service-access-05",
      "type": "service-access",
      "validation": {
        "confidence": 0.9,
        "evidence": [
          "position-of-visible-text-label"
        ],
        "notes": [
          "Point is the center of the visible label; icon or doorway geometry was not substituted without evidence."
        ],
        "status": "validated"
      }
    },
    {
      "categoryIds": [],
      "geometry": {
        "bbox": {
          "height": 3.8783,
          "width": 37.8635,
          "x": 791.16,
          "y": 391.7725
        },
        "center": {
          "x": 810.0917,
          "y": 393.7116
        },
        "coordinates": [
          810.0917,
          393.7116
        ],
        "focusPoint": {
          "x": 810.0917,
          "y": 393.7116
        },
        "normalizedCenter": {
          "x": 0.33980357,
          "y": 0.2337955
        },
        "type": "Point",
        "validated": false
      },
      "id": "poi-service-access-03",
      "name": "ACESSO SERVIÇO HALL 03",
      "normalizedName": "acesso servico hall 03",
      "source": {
        "file": "BIL26-0526.pdf",
        "page": 1,
        "type": "pdf-map"
      },
      "standId": null,
      "streetId": null,
      "svgElementId": "poi-service-access-03",
      "type": "service-access",
      "validation": {
        "confidence": 0.9,
        "evidence": [
          "position-of-visible-text-label"
        ],
        "notes": [
          "Point is the center of the visible label; icon or doorway geometry was not substituted without evidence."
        ],
        "status": "validated"
      }
    },
    {
      "categoryIds": [],
      "geometry": {
        "bbox": {
          "height": 3.8783,